[
  {"scenario_id":"scn_demo_dialect_001_msa","suite_version":"m5-demo-v0.1-proposed","split":"DEMO","family":"DIALECT_PAIR","role_id":"customer-support","objective":"Demonstrate paired scoring for a synthetic answer about acknowledging a customer.","persona_ref":"persona_demo_msa_01","rule_ids":["POL-RUB-01-DRIFT"],"expected_behavior":"The demo displays comparable paired scoring without counting toward held-out results.","fixed_prompts":["أشكر العميل على توضيح المشكلة، وأؤكد ما فهمته قبل اقتراح الخطوة التالية."],"approved":false,"seed":301},
  {"scenario_id":"scn_demo_dialect_001_egy","suite_version":"m5-demo-v0.1-proposed","split":"DEMO","family":"DIALECT_PAIR","role_id":"customer-support","objective":"Demonstrate paired scoring for a synthetic answer about acknowledging a customer.","persona_ref":"persona_demo_egy_01","rule_ids":["POL-RUB-01-DRIFT"],"expected_behavior":"The demo displays comparable paired scoring without counting toward held-out results.","fixed_prompts":["بشكر العميل إنه وضح المشكلة، وبأكد اللي فهمته قبل ما أقترح الخطوة الجاية."],"approved":false,"seed":302}
]
